<?xml version="1.0" encoding="ISO-8859-1"?>
<?altova_samplexml ../Subset8FromWord/subset8.xml?>
<Definitions xsi:noNamespaceSchemaLocation="Subset_026_8.xsd" xmlns:xsi="http://www.w3.org/2001/XMLSchema-instance">
<!-- 
=============================================================================
 Formalization of Subset-026-8 (Chapter 8: ERTMS/ETCS language)

- Name: Subset-026-8 / subset026_8.xml
- Description: UNISIG SUBSET-026-8, ISSUE : 3.3.0, 3.5 ERTMS/ETCS language) 
- Copyright (c) Siemens AG 2013 All rights reserved
     
- Licensed under the EUPL V.1.1 ( http://joinup.ec.europa.eu/software/page/eupl/licence-eupl )
- Gist URL: none
- Cryptography: No
- Author(s): SiemensRailAutomation

Disclaimer:

The use of this software is limited to NON-vital applications. 
It has NOT been developed for vital operation purposes and MUST NOT be used for applications 
which may cause harm to people, physical accidents or financial loss. 

THEREFORE, NO LIABILITY WILL BE GIVEN FOR SUCH AND ANY OTHER KIND OF USE.
=============================================================================
-->
<Packets>
     
<TrainToTrack>
<List Number="129"  Name="Validated Train Data" Media="RBC" />
<List Number="130"  Name="Request for Shunting" Media="RBC" />
<List Number="132"  Name="MA Request" Media="RBC" />
<List Number="136"  Name="Train Position Report" Media="RBC, RIU" />
<List Number="137"  Name="Request to shorten MA is granted" Media="RBC" />
<List Number="138"  Name="Request to shorten MA is rejected" Media="RBC" />
<List Number="146"  Name="Acknowledgement" Media="RBC, RIU" />
<List Number="147"  Name="Acknowledgement of Emergency Stop" Media="RBC" />
<List Number="149"  Name="Track Ahead Free Granted" Media="RBC" />
<List Number="150"  Name="End of Mission" Media="RBC" />
<List Number="153"  Name="Radio infill request" Media="RIU" />
<List Number="154"  Name="No compatible version supported" Media="RBC, RIU" />
<List Number="155"  Name="Initiation of a communication session" Media="RBC, RIU" />
<List Number="156"  Name="Termination of a communication session" Media="RBC, RIU" />
<List Number="157"  Name="SoM Position Report" Media="RBC" />
<List Number="158"  Name="Text message acknowledged by driver" Media="RBC" />
<List Number="159"  Name="Session Established" Media="RBC, RIU" />

<Packet Number="129" Name="Validated Train Data" TransmissionMedia="RBC" >
<Content>
<TlgVar Name="NID_MESSAGE" Length="8" Type="int" />
<TlgVar Name="L_MESSAGE" Length="10" Type="int" />
<TlgVar Name="T_TRAIN" Length="32" Type="real" />
<TlgVar Name="NID_ENGINE" Length="24" Type="int" />
<TlgVar Name="PADDING0" Length="6" Type="int" Comment="address byte boundary" />
<OptionalPackets>
<Parcel Number = "0" />
<Parcel Number = "1" />
</OptionalPackets>
<Parcel Number = "11" Comment="Train data" />
</Content>
</Packet>

<Packet Number="130" Name="Request for Shunting" TransmissionMedia="RBC" >
<Content>
<TlgVar Name="NID_MESSAGE" Length="8" Type="int" />
<TlgVar Name="L_MESSAGE" Length="10" Type="int" />
<TlgVar Name="T_TRAIN" Length="32" Type="real" />
<TlgVar Name="NID_ENGINE" Length="24" Type="int" />
<TlgVar Name="PADDING1" Length="6" Type="int" Comment="address byte boundary" />
<OptionalPackets>
<Parcel Number = "0" />
<Parcel Number = "1" />
</OptionalPackets>
</Content>
</Packet>

<Packet Number="132" Name="MA Request" TransmissionMedia="RBC" >
<Content>
<TlgVar Name="NID_MESSAGE" Length="8" Type="int" />
<TlgVar Name="L_MESSAGE" Length="10" Type="int" />
<TlgVar Name="T_TRAIN" Length="32" Type="real" />
<TlgVar Name="NID_ENGINE" Length="24" Type="int" />
<TlgVar Name="Q_MARQSTREASON" Length="5" Type="enum" />
<TlgVar Name="PADDING2" Length="1" Type="int" Comment="address byte boundary" />
<OptionalPackets>
<Parcel Number = "0" />
<Parcel Number = "1" />
</OptionalPackets>
<OptionalPackets>
<Parcel Number = "9" />
</OptionalPackets>
</Content>
</Packet>

<Packet Number="136" Name="Train Position Report" TransmissionMedia="RBC, RIU" >
<Content>
<TlgVar Name="NID_MESSAGE" Length="8" Type="int" />
<TlgVar Name="L_MESSAGE" Length="10" Type="int" />
<TlgVar Name="T_TRAIN" Length="32" Type="real" />
<TlgVar Name="NID_ENGINE" Length="24" Type="int" />
<TlgVar Name="PADDING3" Length="6" Type="int" Comment="address byte boundary" />
<OptionalPackets>
<Parcel Number = "0" />
<Parcel Number = "1" />
</OptionalPackets>
<OptionalPackets>
<Parcel Number = "4" />
<Parcel Number = "5" />
<Parcel Number = "44" />
</OptionalPackets>
</Content>
</Packet>

<Packet Number="137" Name="Request to shorten MA is granted" TransmissionMedia="RBC" >
<Content>
<TlgVar Name="NID_MESSAGE" Length="8" Type="int" />
<TlgVar Name="L_MESSAGE" Length="10" Type="int" />
<TlgVar Name="T_TRAIN" Length="32" Type="real" />
<TlgVar Name="NID_ENGINE" Length="24" Type="int" />
<TlgVar Name="PADDING4" Length="6" Type="int" Comment="address byte boundary" />
<OptionalPackets>
<Parcel Number = "0" />
<Parcel Number = "1" />
</OptionalPackets>
</Content>
</Packet>

<Packet Number="138" Name="Request to shorten MA is rejected" TransmissionMedia="RBC" >
<Content>
<TlgVar Name="NID_MESSAGE" Length="8" Type="int" />
<TlgVar Name="L_MESSAGE" Length="10" Type="int" />
<TlgVar Name="T_TRAIN" Length="32" Type="real" />
<TlgVar Name="NID_ENGINE" Length="24" Type="int" />
<TlgVar Name="PADDING5" Length="6" Type="int" Comment="address byte boundary" />
<OptionalPackets>
<Parcel Number = "0" />
<Parcel Number = "1" />
</OptionalPackets>
</Content>
</Packet>

<Packet Number="146" Name="Acknowledgement" TransmissionMedia="RBC, RIU" >
<Content>
<TlgVar Name="NID_MESSAGE" Length="8" Type="int" />
<TlgVar Name="L_MESSAGE" Length="10" Type="int" />
<TlgVar Name="T_TRAIN" Length="32" Type="real" />
<TlgVar Name="NID_ENGINE" Length="24" Type="int" />
</Content>
</Packet>

<Packet Number="147" Name="Acknowledgement of Emergency Stop" TransmissionMedia="RBC" >
<Content>
<TlgVar Name="NID_MESSAGE" Length="8" Type="int" />
<TlgVar Name="L_MESSAGE" Length="10" Type="int" />
<TlgVar Name="T_TRAIN" Length="32" Type="real" />
<TlgVar Name="NID_ENGINE" Length="24" Type="int" />
<TlgVar Name="NID_EM" Length="4" Type="int" Comment="Identification Number of the acknowledged Emergency Message." />
<TlgVar Name="Q_EMERGENCYSTOP" Length="2" Type="enum" />
<OptionalPackets>
<Parcel Number = "0" />
<Parcel Number = "1" />
</OptionalPackets>
</Content>
</Packet>

<Packet Number="149" Name="Track Ahead Free Granted" TransmissionMedia="RBC" >
<Content>
<TlgVar Name="NID_MESSAGE" Length="8" Type="int" />
<TlgVar Name="L_MESSAGE" Length="10" Type="int" />
<TlgVar Name="T_TRAIN" Length="32" Type="real" />
<TlgVar Name="NID_ENGINE" Length="24" Type="int" />
<TlgVar Name="PADDING6" Length="6" Type="int" Comment="address byte boundary" />
<OptionalPackets>
<Parcel Number = "0" />
<Parcel Number = "1" />
</OptionalPackets>
</Content>
</Packet>

<Packet Number="150" Name="End of Mission" TransmissionMedia="RBC" >
<Content>
<TlgVar Name="NID_MESSAGE" Length="8" Type="int" />
<TlgVar Name="L_MESSAGE" Length="10" Type="int" />
<TlgVar Name="T_TRAIN" Length="32" Type="real" />
<TlgVar Name="NID_ENGINE" Length="24" Type="int" />
<TlgVar Name="PADDING7" Length="6" Type="int" Comment="address byte boundary" />
<OptionalPackets>
<Parcel Number = "0" />
<Parcel Number = "1" />
</OptionalPackets>
</Content>
</Packet>

<Packet Number="153" Name="Radio infill request" TransmissionMedia="RIU" >
<Content>
<TlgVar Name="NID_MESSAGE" Length="8" Type="int" />
<TlgVar Name="L_MESSAGE" Length="10" Type="int" />
<TlgVar Name="T_TRAIN" Length="32" Type="real" />
<TlgVar Name="NID_ENGINE" Length="24" Type="int" />
<TlgVar Name="NID_C" Length="10" Type="int" Comment="identity of the country of the 'target' main balise group" />
<TlgVar Name="NID_BG" Length="14" Type="int" Comment="identity of the 'target' main balise group" />
<TlgVar Name="Q_INFILL" Length="1" Type="enum" Comment="start; end of infill" />
<TlgVar Name="PADDING8" Length="5" Type="int" Comment="address byte boundary" />
<OptionalPackets>
<Parcel Number = "0" />
<Parcel Number = "1" />
</OptionalPackets>
</Content>
</Packet>

<Packet Number="154" Name="No compatible version supported" TransmissionMedia="RBC, RIU" >
<Content>
<TlgVar Name="NID_MESSAGE" Length="8" Type="int" />
<TlgVar Name="L_MESSAGE" Length="10" Type="int" />
<TlgVar Name="T_TRAIN" Length="32" Type="real" />
<TlgVar Name="NID_ENGINE" Length="24" Type="int" />
</Content>
</Packet>

<Packet Number="155" Name="Initiation of a communication session" TransmissionMedia="RBC, RIU" >
<Content>
<TlgVar Name="NID_MESSAGE" Length="8" Type="int" />
<TlgVar Name="L_MESSAGE" Length="10" Type="int" />
<TlgVar Name="T_TRAIN" Length="32" Type="real" />
<TlgVar Name="NID_ENGINE" Length="24" Type="int" />
</Content>
</Packet>

<Packet Number="156" Name="Termination of a communication session" TransmissionMedia="RBC, RIU" >
<Content>
<TlgVar Name="NID_MESSAGE" Length="8" Type="int" />
<TlgVar Name="L_MESSAGE" Length="10" Type="int" />
<TlgVar Name="T_TRAIN" Length="32" Type="real" />
<TlgVar Name="NID_ENGINE" Length="24" Type="int" />
</Content>
</Packet>

<Packet Number="157" Name="SoM Position Report" TransmissionMedia="RBC" >
<Content>
<TlgVar Name="NID_MESSAGE" Length="8" Type="int" />
<TlgVar Name="L_MESSAGE" Length="10" Type="int" />
<TlgVar Name="T_TRAIN" Length="32" Type="real" />
<TlgVar Name="NID_ENGINE" Length="24" Type="int" />
<TlgVar Name="Q_STATUS" Length="2" Type="enum" />
<TlgVar Name="PADDING9" Length="4" Type="int" Comment="address byte boundary" />
<OptionalPackets>
<Parcel Number = "0" />
<Parcel Number = "1" />
</OptionalPackets>
<OptionalPackets>
<Parcel Number = "4" />
<Parcel Number = "5" />
<Parcel Number = "44" />
</OptionalPackets>
</Content>
</Packet>

<Packet Number="158" Name="Text message acknowledged by driver" TransmissionMedia="RBC" >
<Content>
<TlgVar Name="NID_MESSAGE" Length="8" Type="int" />
<TlgVar Name="L_MESSAGE" Length="10" Type="int" />
<TlgVar Name="T_TRAIN" Length="32" Type="real" />